title,id,description,link,type,level,skills,author
Introduction to GitHub,foundations-0-github,"Introduces newcomers to using and understanding GitHub. Includes instructions for creating a GitHub account and repository, learning how to commit changes, and turning on GitHub Pages.",https://github.com/learn-static/foundations-0-github,module,beginner,GitHub; Git,Olivia Wikle
Introduction to the Web and HTML,foundations-1-html,"Provides an overview of the fundamental building blocks of websites, HTML. Broken into several parts that can be reviewed separately.",https://github.com/learn-static/foundations-1-html,module,beginner,GitHub; HTML; CSS,Evan Williamson
Introduction to Markdown,foundations-2-markdown,"Instroduces newcomers to Markdown, a markup language for adding formatting elements to plain text files.",https://github.com/learn-static/foundations-2-markdown,module,beginner,GitHub; Markdown,Kate Thornhill
Introduction to Data,foundations-3-data,"Gives newcomers a surface-level introduction to digital project metadata to configure a static website. Includes an introduction to metadata, an introduction to using and editing spreadsheets in Google Sheets, and instructions on how to download an existing metadata sheet, edit it in Google Sheets, save it as a csv and re-upload it to GitHub.",https://github.com/learn-static/foundations-3-data,module,intermediate,GitHub; Google Sheets,Gabriele Hayden
Introduction to Computational Methods,foundations-4-computation,"Using sample data included in the repository, introduces steps that demonstrate how Jekyll builds a static site and how the Liquid template language is used to manipulate and control the data that populates the site.",https://github.com/learn-static/foundations-4-computation,module,intermediate,GitHub; Jekyll; Liquid,Devin Becker